{
  "schema_version": "1.0",
  "task_id": "T2-ENTERPRISE-PILOT-BLIND-V1",
  "method_id": "t2-ab-strong-composition",
  "run_id": "T2-AB-RUN-001",
  "round": 2,
  "previous_round_hash": "605398200a4b0dcc6a03c5b3bad74585c25ce296a3763a3c1e82437eb71d1f70",
  "queries": [
    {
      "authority_id": "PROVIDER-TECH",
      "request_type": "REQUEST_MINIMAL_PROBE",
      "purpose": "为采购方 sandbox 内运行固定分析容器这一未资格化候选，披露一次受限 probe 所需的最小精确条件：executor、environment、version、只读 operation、resource、成功判据、失败停止与 recovery；仅用于判断能否前瞻资格化该精确 operation，不据此推断采购方 permission、服务承诺或其他环境能力。",
      "relation_version_ref": "REL-T2-V2-CANDIDATE",
      "retention_scope": "RUN_ONLY"
    },
    {
      "authority_id": "BUYER-DATA",
      "request_type": "REQUEST_BOUNDED_PROBE_AUTHORIZATION",
      "purpose": "针对固定分析容器在采购方 sandbox 内、原始数据不离域、仅执行明确批准的聚合只读查询、禁止训练和持久记忆且由采购方审计回执见证的候选 probe，披露是否可授权以及授权所需的最小数据范围、查询边界、credential、审计、期限和撤销条件；仅请求该 probe 的有界 permission，不视为 REL-T2-V2-CANDIDATE、正式试点或后续重复运行的授权。",
      "relation_version_ref": "REL-T2-V2-CANDIDATE",
      "retention_scope": "RUN_ONLY"
    }
  ]
}